{
  "schema_version": "1.0.0",
  "id": "goal_threading",
  "kind": "goal_node",
  "node_kind": "branch",
  "parent": "goal_cloud-architectures",
  "title": "Thread (q, ω) pairs from anchor under the connectability tube",
  "state": "closed",
  "spent": {
    "runs": 3,
    "wall_s": 0
  },
  "contract_refs": [],
  "child_runs": [
    "s061a_thread_smoke",
    "s061b_multi_step_thread",
    "s061c_seed28_thread"
  ],
  "is_trunk_artifact": false,
  "created_at": "2026-06-01T00:00:00Z",
  "updated_at": "2026-06-01T00:00:00Z",
  "last_measured": {
    "run": "s061c_seed28_thread",
    "summary": "cluster-disappearance works; lineage tracking needs constant-ω pairs",
    "at": "2026-05-11T00:00:00Z"
  }
}
