{
  "schema_version": "1.0.0",
  "id": "goal_convention-bug",
  "kind": "goal_node",
  "node_kind": "branch",
  "parent": "goal_forward-substrate",
  "title": "ω-sign propagator convention bug: detect, fix, validate, replicate",
  "state": "closed",
  "spent": {
    "runs": 3,
    "wall_s": 0
  },
  "contract_refs": [],
  "child_runs": [
    "s065_propagator_convention_spice_test",
    "s066_lj2000_nonconservation",
    "s067_postfix_propagator_validation"
  ],
  "is_trunk_artifact": false,
  "created_at": "2026-06-01T00:00:00Z",
  "updated_at": "2026-06-01T00:00:00Z",
  "last_measured": {
    "run": "s067_postfix_propagator_validation",
    "summary": "4/4 post-fix gates PASS; cohort drift ~0; fix commit d5705ff invalidated s001-s066",
    "at": "2026-05-12T00:00:00Z"
  }
}
